<?xml version="1.0" encoding="UTF-8"?>
<lista_zalbi_na_odluku
    xmlns="http://ftn.uns.ac.rs/zalba_na_odluku"
    xmlns:xsi="http://www.w3.org/2001/XMLSchema-instance"
    xsi:schemaLocation="http://ftn.uns.ac.rs/zalba_na_odluku zalba_na_odluku.xsd"
    xmlns:xs="http://www.w3.org/2001/XMLSchema#"
    xmlns:obav="http://www.ftn.uns.ac.rs/rdf/example"
    xmlns:pred="http://www.ftn.uns.ac.rs/rdf/examples/predicate/"
    >
    <zalba_na_odluku vocab="http://www.ftn.uns.ac.rs/rdf/examples/predicate/" 
    			about="http://www.ftn.uns.ac.rs/rdf/examples/resenje/101">
    <osnovni_podaci>            
    	<podaci_o_zaliocu>
    		<zalioc_ime property="pred:ime_zalioca" datatype="xs:string">Nikola</zalioc_ime>
    		<zalioc_prezime property="pred:prezime_zalioca" datatype="xs:string">Petrovic</zalioc_prezime>
    		<zalioc_naziv_zalbe property="pred:naziv_zalbe" datatype="xs:string">Zalba1</zalioc_naziv_zalbe>
    		<zalioc_adresa property="pred:adresa_zalioca" datatype="xs:string">Mise Dimitrijevica 44</zalioc_adresa>
    		<zalioc_sediste property="pred:sediste_zalioca" datatype="xs:string">Novi Sad</zalioc_sediste>
       
		</podaci_o_zaliocu>
        
        <podaci_o_organu>
        	<naziv property="pred:naziv_organa" datatype="xs:string">FTN</naziv>
        </podaci_o_organu>

	</osnovni_podaci>   
    
   <sadrzaj>
   		<broj_zalbe property="pred:broj_zalbe" datatype="xs:integer">101</broj_zalbe>
   		<godina_zalbe property="pred:godina_zalbe" datatype="xs:string">2020</godina_zalbe>
   		<datum_odbijenog_zahteva property="pred:datum_odbijenog_zahteva" datatype="xs:string">2020-12-04</datum_odbijenog_zahteva>
   		<odluka_organa_vlasti property="pred:odluka" datatype="xs:string">Odluka organa vlasti</odluka_organa_vlasti>
   </sadrzaj>
   
   <podnozje>
   		<mesto_zakljucka_zalbe property="pred:mesto_zakljucka_zalbe" datatype="xs:string">Novi Sad</mesto_zakljucka_zalbe>
   		<datum_zakljucka_zalbe property="pred:datum_zakljucka_zalbe" datatype="xs:string">2021-01-12</datum_zakljucka_zalbe>
   		
   		<podaci_o_zaliocu>
    		<zalioc_ime property="pred:ime_zalioca" datatype="xs:string">Nikola</zalioc_ime>
    		<zalioc_prezime property="pred:prezime_zalioca" datatype="xs:string">Petrovic</zalioc_prezime>
    		<zalioc_adresa property="pred:adresa_zalioca" datatype="xs:string">Mise Dimitrijevica 44</zalioc_adresa>
    		<drugi_podaci_za_kontakt property="pred:kontakt_zalioca" datatype="xs:string">petrovicnik96@gmail.com</drugi_podaci_za_kontakt>
    		<potpis_zalioca property="pred:potpis_zalioca" datatype="xs:string">NikolaPetrovic</potpis_zalioca>
    		
		</podaci_o_zaliocu>
   </podnozje>
           
     </zalba_na_odluku>
</lista_zalbi_na_odluku>
